record_id,title,authors,language,publication_year,publisher,isbn_or_issn,segment,subsegment,perspective,topics,access_type,dataset_status
maja-0006,専門家のための 中小PMI実践ガイドブック,事業承継支援コンサルティング研究会,ja,2024,ロギカ書房,,Securities & Investment Banking,M&A Execution/FA,practice,PMI 実務,unknown,draft
maja-0007,PMIの実務プロセス,木俣貴光; 三菱UFJリサーチ&コンサルティング株式会社,ja,2023,中央経済社,4502453013,Securities & Investment Banking,M&A Execution/FA,practice,PMI 実務,unknown,draft
maja-0008,中小企業のM&Aを成功に導くスモールPMI実務入門,寺嶋直史; 原田総介; 幡野康夫,ja,2023,中央経済社,4502457914,Securities & Investment Banking,M&A Execution/FA,practice,PMI 実務,unknown,draft
maja-0009,M&Aを成功に導く中小企業のPMI実践マニュアル,皿谷将,ja,2023,日本法令,4539729640,Securities & Investment Banking,M&A Execution/FA,practice,PMI 実務,unknown,draft
maja-0010,次世代ビジネス対応　契約審査手続マニュアル－「新しい資本主義」を踏まえた契約類型－,契約審査実務研究会,ja,2022,新日本法規出版,,Securities & Investment Banking,M&A Execution/FA,practice,株式譲渡契約,unknown,draft
maja-0011,M&A3.0 事業承継の切り札 M&A TECH,株式会社M&A総合研究所代表取締役佐上峻作; 株式会社M&A総合研究所取締役矢吹明大,ja,2021,パレード,,Securities & Investment Banking,M&A Execution/FA,practice,M&A エグゼキューション,unknown,draft
maja-0012,図解入門ﾋﾞｼﾞﾈｽ最新業種別M&Aの成功ﾎﾟｲﾝﾄがよ〜くわかる本,笹川敏幸,ja,2021,秀和システム,9784798064444,Securities & Investment Banking,M&A Execution/FA,practice,M&A 実務,unknown,draft
maja-0013,事業者必携 事業再編・M&A【合併・会社分割・事業譲渡】の法律と手続き,,ja,2021,三修社,9784384048759,Securities & Investment Banking,M&A Execution/FA,practice,M&A 実務,unknown,draft
maja-0014,民法を武器として使いたい ビジネスパーソンの契約の基本教科書,長瀬総合法律事務所,ja,2021,日本能率協会マネジメントセンター,,Securities & Investment Banking,M&A Execution/FA,practice,基本合意 契約,unknown,draft
maja-0015,クロスボーダーM&Aの契約実務,森幹晴,ja,2021,Unknown,4502372714,Securities & Investment Banking,M&A Execution/FA,practice,M&A 契約 実務,unknown,draft
maja-0016,M&A 買収者の見解、経営者の異論,ケイトウェリング; マリオガベリ,ja,2020,Pan Rolling Inc,9784775972601,Securities & Investment Banking,M&A Execution/FA,practice,M&A プロセス管理,unknown,draft
maja-0017,日本型PMIの方法論,竹林 信幸,ja,2019,President Inc,,Securities & Investment Banking,M&A Execution/FA,practice,デューデリジェンス,unknown,draft
maja-0018,弁護士・公認会計士の視点と実務中小企業のM&A,加藤真朗,ja,2018,Unknown,4817845082,Securities & Investment Banking,M&A Execution/FA,practice,M&A エグゼキューション,unknown,draft
maja-0019,トップコンサルタントが明かす　ポストM&A成功44の鉄則,田中大貴,ja,2018,日経BP,,Securities & Investment Banking,M&A Execution/FA,practice,PMI 実務,unknown,draft
maja-0020,事業担当者のための逆引きビジネス法務ハンドブック　Ｍ＆Ａ契約書式編,塩野　誠; 宮下　和昌,ja,2018,東洋経済新報社,9784492533987,Securities & Investment Banking,M&A Execution/FA,practice,M&A 契約 実務,unknown,draft
maja-0021,Business Law Handbook　ビジネス契約書の読み方・書き方・直し方,長瀬佑志; 長瀬威志; 母壁明日香,ja,2017,日本能率協会マネジメントセンター,,Securities & Investment Banking,M&A Execution/FA,practice,株式譲渡契約,unknown,draft
maja-0022,法務デューデリジェンス チェックリスト,佐藤 義幸,ja,2016,good.book,,Securities & Investment Banking,M&A Execution/FA,practice,デューデリジェンス,unknown,draft
maja-0023,M&Aを成功に導くPMI,三宅卓,ja,2015,President Inc,,Securities & Investment Banking,M&A Execution/FA,practice,M&A プロセス管理,unknown,draft
maja-0024,M&A実務の基礎,柴田義人; 石原坦; 関根良太,ja,2015,Unknown,4785722851,Securities & Investment Banking,M&A Execution/FA,practice,M&A 契約 実務,unknown,draft
maja-0025,図解入門ビジネス 最新ビジネスデューデリがよーくわかる本［第2版］,菅原祥公,ja,2013,秀和システム,,Securities & Investment Banking,M&A Execution/FA,practice,デューデリジェンス,unknown,draft
dden-0001,Kernanalysen der Financial Due Diligence,Thomas Pomp,en,2024,Unknown,,Securities & Investment Banking,M&A Due Diligence,practice,financial due diligence,unknown,draft
dden-0002,Due Diligence : Book 2,Christian V. Reinhardt,en,2021,Unknown,,Securities & Investment Banking,M&A Due Diligence,practice,due diligence,unknown,draft
dden-0003,AMA Handbook of Due Diligence,William Crilly; Andrew Sherman,en,2021,Unknown,,Securities & Investment Banking,M&A Due Diligence,practice,financial due diligence,unknown,draft
dden-0004,Due Diligence in Mortgage Repurchases and Fannie Mae,United States House of Representatives; Committee on Financial Services; United States United States Congress,en,2019,Unknown,,Securities & Investment Banking,M&A Due Diligence,practice,financial due diligence,unknown,draft
dden-0005,Due Diligence 2018,Michael Tooma,en,2018,Unknown,,Securities & Investment Banking,M&A Due Diligence,practice,due diligence,unknown,draft
dden-0006,Financial Crimes Enforcement Network - Anti-Money Laundering Programs - Special Due Diligence Programs for Certain Foreign Accounts (US Financial Crimes Enforcement Network Regulation) (FINCEN) (2018 Edition),The Law The Law Library,en,2018,Unknown,,Securities & Investment Banking,M&A Due Diligence,practice,financial due diligence,unknown,draft
dden-0007,Software Due Diligence,Christian Demant,en,2017,Unknown,,Securities & Investment Banking,M&A Due Diligence,practice,due diligence,unknown,draft
dden-0008,Checklists for Due Diligence,Peter Howson,en,2017,Unknown,,Securities & Investment Banking,M&A Due Diligence,practice,due diligence,unknown,draft
dden-0009,Financial Due Diligence For Commercial Real Estate,Jerold Ipsen,en,2017,Unknown,,Securities & Investment Banking,M&A Due Diligence,practice,financial due diligence,unknown,draft
dden-0010,Enhanced Due Diligence - The Complete BSA/AML Desktop Reference,Howard Steiner; Sephen L. Marini,en,2017,Unknown,,Securities & Investment Banking,M&A Due Diligence,practice,financial due diligence,unknown,draft
dden-0011,Financial Due Diligence ALS Instrument Zur Minderung Von Akquisitionsrisiken,Thomas Otte,en,2016,Unknown,,Securities & Investment Banking,M&A Due Diligence,practice,financial due diligence,unknown,draft
dden-0012,Practical Operational Due Diligence on Hedge Funds,Rajiv Jaitly,en,2016,Unknown,,Securities & Investment Banking,M&A Due Diligence,practice,financial due diligence,unknown,draft
dden-0013,Real Estate Due Diligence,Mary Ann Hallenborg,en,2015,Unknown,,Securities & Investment Banking,M&A Due Diligence,practice,due diligence,unknown,draft
dden-0014,Praxishandbuch Financial Due Diligence,Thomas Pomp,en,2015,Unknown,,Securities & Investment Banking,M&A Due Diligence,practice,financial due diligence,unknown,draft
dden-0015,Financial Due Diligence. ein Analyseinstrument Bei Unternehmensakquisitionen,Serpil Mesepinar,en,2015,Unknown,,Securities & Investment Banking,M&A Due Diligence,practice,financial due diligence,unknown,draft
dden-0016,Financial Due Diligence Als Instrument des Risikomanagements,Thomas Otte,en,2014,Unknown,,Securities & Investment Banking,M&A Due Diligence,practice,financial due diligence,unknown,draft
dden-0017,Due Diligence in China,Kwek Ping Yong,en,2013,Unknown,,Securities & Investment Banking,M&A Due Diligence,practice,due diligence,unknown,draft
dden-0018,Durchführung Einer Financial Due Diligence Im Rahmen Einer Unternehmensakquisition,Sven Bollmann,en,2013,Unknown,,Securities & Investment Banking,M&A Due Diligence,practice,financial due diligence,unknown,draft
dden-0019,Operations due diligence,James F. Grebey,en,2012,Unknown,,Securities & Investment Banking,M&A Due Diligence,practice,financial due diligence,unknown,draft
dden-0020,HR Due Diligence,ChyeKok Ho; ChinSeng Koh,en,2011,Unknown,,Securities & Investment Banking,M&A Due Diligence,practice,due diligence,unknown,draft
dden-0021,The AMA handbook of due diligence,William M. Crilly,en,2010,Unknown,,Securities & Investment Banking,M&A Due Diligence,practice,due diligence,unknown,draft
dden-0022,Tax due diligence,Matthew Peppitt,en,2009,Unknown,,Securities & Investment Banking,M&A Due Diligence,practice,due diligence,unknown,draft
dden-0023,Logistics Due Diligence,Franz Nothardt,en,2009,Unknown,,Securities & Investment Banking,M&A Due Diligence,practice,due diligence,unknown,draft
dden-0024,Due Diligence bei Unternehmensakquisitionen,Wolfgang Berens,en,2008,Unknown,,Securities & Investment Banking,M&A Due Diligence,practice,due diligence,unknown,draft
dden-0025,Hedge fund due diligence,Randy Shain,en,2008,Unknown,,Securities & Investment Banking,M&A Due Diligence,practice,due diligence,unknown,draft
ddja-0001,企業の成長を見抜く　ビジネスデューデリジェンス入門　M&Aを成功させる事業性評価の秘訣,小笠原知洋,ja,2025,日経BP,,Securities & Investment Banking,M&A Due Diligence,practice,デューデリジェンス,unknown,draft
ddja-0002,中小企業М&Aにおける財務デューデリジェンスのすべて【第2版】,久米雅彦,ja,2025,Unknown,432214568X,Securities & Investment Banking,M&A Due Diligence,practice,M&A DD 実務,unknown,draft
ddja-0003,BDDを知るビジネスDDの全体像と設計,PwCアドバイザリー合同会社,ja,2024,中央経済社,4502483117,Securities & Investment Banking,M&A Due Diligence,practice,ビジネスDD,unknown,draft
ddja-0004,M&Aを成功に導く法務デューデリジェンスの実務〈第4版〉,長島・大野・常松法律事務所,ja,2023,Unknown,4502459518,Securities & Investment Banking,M&A Due Diligence,practice,M&A DD 実務,unknown,draft
ddja-0005,M&A財務デューデリジェンス入門,株式会社G&Sソリューションズ,ja,2022,Unknown,4419068167,Securities & Investment Banking,M&A Due Diligence,practice,財務DD,unknown,draft
ddja-0006,事業担当者のための逆引きビジネス法務ハンドブック　第２版,塩野　誠; 宮下　和昌,ja,2021,東洋経済新報社,9784492534397,Securities & Investment Banking,M&A Due Diligence,practice,法務DD,unknown,draft
ddja-0007,Ｍ＆Ａ・組織再編の人事　トランスフォーメーションを達成するために,村中靖; 佐藤しおり,ja,2021,日経BP,,Securities & Investment Banking,M&A Due Diligence,practice,人事DD,unknown,draft
ddja-0008,M&Aにおける労働法務DDのポイント,東京弁護士会労働法制特別委員会企業集団再編と労働法部会,ja,2020,Unknown,4785728000,Securities & Investment Banking,M&A Due Diligence,practice,法務DD,unknown,draft
ddja-0009,事業担当者のための逆引きビジネス法務ハンドブック　Ｍ＆Ａ契約書式編,塩野　誠; 宮下　和昌,ja,2018,東洋経済新報社,9784492533987,Securities & Investment Banking,M&A Due Diligence,practice,M&A DD 実務,unknown,draft
ddja-0010,M&Aを成功に導くビジネスデューデリジェンスの実務,PwCアドバイザリー合同会社,ja,2018,Unknown,4502272019,Securities & Investment Banking,M&A Due Diligence,practice,M&A DD 実務,unknown,draft
ddja-0011,法務デューデリジェンス チェックリスト,佐藤 義幸,ja,2016,good.book,,Securities & Investment Banking,M&A Due Diligence,practice,デューデリジェンス,unknown,draft
ddja-0012,M&Aを成功に導く知的財産デューデリジェンスの実務,TMI総合法律事務所; デロイトトーマツファイナンシャルアドバイザリー,ja,2016,Unknown,4502189316,Securities & Investment Banking,M&A Due Diligence,practice,M&A DD 実務,unknown,draft
ddja-0013,税務デューデリジェンスの実務,デロイトトーマツ,ja,2016,Unknown,4502196118,Securities & Investment Banking,M&A Due Diligence,practice,M&A DD 実務,unknown,draft
ddja-0014,ビジネスを「先読み」する人の日本経済史の読み方,小宮一慶,ja,2015,KADOKAWA,,Securities & Investment Banking,M&A Due Diligence,practice,ビジネスDD,unknown,draft
ddja-0015,M&Aを成功に導く財務デューデリジェンスの実務,プライスウォーターハウスクーパース,ja,2014,Unknown,4502117811,Securities & Investment Banking,M&A Due Diligence,practice,財務DD,unknown,draft
ddja-0016,法務デューデリジェンスの実務,長島大野常松法律事務所,ja,2014,Unknown,4502078700,Securities & Investment Banking,M&A Due Diligence,practice,M&A DD 実務,unknown,draft
ddja-0017,図解入門ビジネス 最新ビジネスデューデリがよーくわかる本［第2版］,菅原祥公,ja,2013,秀和システム,,Securities & Investment Banking,M&A Due Diligence,practice,デューデリジェンス,unknown,draft
ddja-0018,日経ビジネス,,ja,2013,Unknown,,Securities & Investment Banking,M&A Due Diligence,practice,財務DD,unknown,draft
ddja-0019,一橋ビジネスレビュ-,,ja,2013,Unknown,,Securities & Investment Banking,M&A Due Diligence,practice,法務DD,unknown,draft
ddja-0020,図解入門ビジネス最新ビジネスデューデリがよーくわかる本,菅原祥公,ja,2013,秀和システム,4798035998,Securities & Investment Banking,M&A Due Diligence,practice,ビジネスDD,unknown,draft
ddja-0021,本格ビジネスサイトを作りながら学ぶ WordPressの教科書2,プライム・ストラテジー株式会社,ja,2013,SBクリエイティブ,9784797370966,Securities & Investment Banking,M&A Due Diligence,practice,ビジネスDD,unknown,draft
ddja-0022,財務官戰時報告,,ja,2000,Unknown,,Securities & Investment Banking,M&A Due Diligence,practice,財務DD,unknown,draft
ddja-0023,全国企業財務諸表分析統計,,ja,2000,Unknown,,Securities & Investment Banking,M&A Due Diligence,practice,財務DD,unknown,draft
ddja-0024,Ｍ＆Ａを成功させるデューデリジェンスのことがよくわかる本,新日本有限責任監査法人; 新日本アーンストアンドヤング税理士法人,ja,2000,KADOKAWA,,Securities & Investment Banking,M&A Due Diligence,practice,法務DD,unknown,draft
ddja-0025,一橋ビジネスレビュー　2013 Spring（60巻4号）,一橋大学イノベーション研究センター,ja,2000,東洋経済新報社,,Securities & Investment Banking,M&A Due Diligence,practice,税務DD,unknown,draft
pmi-en-0001,Umbrex Post-Merger Integration Playbook,Umbrex,en,2023,Unknown,,Securities & Investment Banking,PMI,practice,post merger integration,unknown,draft
pmi-en-0002,How Technology Transforms Traditional M&a : Guide for Delivering Post-Merger Integration Projects,Norman Fitting,en,2021,Unknown,,Securities & Investment Banking,PMI,practice,post merger integration,unknown,draft
pmi-en-0003,Post-Merger Management,Kirsten Meynerts-Stiller; Christoph Rohloff,en,2019,Unknown,,Securities & Investment Banking,PMI,practice,post merger integration,unknown,draft
pmi-en-0004,Making Mergers and Acquisitions Work,Matteo Vizzaccaro; Markus Venzin; Fabrizio Rutschmann,en,2017,Unknown,,Securities & Investment Banking,PMI,practice,post merger integration,unknown,draft
pmi-en-0005,Post-Merger-Integration Im Mittelstand,Andreas Kuckertz; Nils Middelberg,en,2016,Unknown,,Securities & Investment Banking,PMI,practice,post merger integration,unknown,draft
pmi-en-0006,Post Merger Integration Beim Unternehmenskauf,Lars Heinrich Osterhues,en,2015,Unknown,,Securities & Investment Banking,PMI,practice,post merger integration,unknown,draft
pmi-en-0007,Post Merger Integration der Forschung und Entwicklung,Christoph Grimpe,en,2015,Unknown,,Securities & Investment Banking,PMI,practice,post merger integration,unknown,draft
pmi-en-0008,Successful Management of Mergers and Acquisitions : Development of a Synergy Tracking Tool for the Post Merger Integration,Vincent Schade,en,2014,Unknown,,Securities & Investment Banking,PMI,practice,post merger integration,unknown,draft
pmi-en-0009,Organisationsentwicklung Als Erfolgsfaktor in der Post Merger Integration,Anna Lena Thomas,en,2013,Unknown,,Securities & Investment Banking,PMI,practice,post merger integration,unknown,draft
pmi-en-0010,Post-Merger-Integration - Erfolgs- and Misserfolgsfaktoren Internationaler Mergers and Acquisitions,Gregor Smole,en,2013,Unknown,,Securities & Investment Banking,PMI,practice,post merger integration,unknown,draft
pmi-en-0011,Development of a Synergy Tracking Tool for the Post Merger Integration,Vincent Schade,en,2013,Unknown,,Securities & Investment Banking,PMI,practice,post merger integration,unknown,draft
pmi-en-0012,Die Rolle der Führung Für Den Erfolg der Post Merger Integration,Damian Minski,en,2013,Unknown,,Securities & Investment Banking,PMI,practice,post merger integration,unknown,draft
pmi-en-0013,Erfolgsfaktoren der Post Merger Integration. Konzepte Zu Einem Ganzheitlichen M and A-Management,Jörg/ Niebuhr Menke,en,2013,Unknown,,Securities & Investment Banking,PMI,practice,post merger integration,unknown,draft
pmi-en-0014,Successful Management of Mergers and Acquisitions,Vincent Schade,en,2013,Unknown,,Securities & Investment Banking,PMI,practice,post merger integration,unknown,draft
pmi-en-0015,Erfolgreiches Change Management in der Post Merger Integration,Karl-Heinz Große Peclum; Markus Krebber; Richard Lips,en,2012,Unknown,,Securities & Investment Banking,PMI,practice,post merger integration,unknown,draft
pmi-en-0016,POST-MERGER-INTEGRATION,Süleyman Yücel,en,2011,Unknown,,Securities & Investment Banking,PMI,practice,post merger integration,unknown,draft
pmi-en-0017,Kollektive Arbeitsrecht in der Post-Merger-Integration,Anna Jung,en,2011,Unknown,,Securities & Investment Banking,PMI,practice,post merger integration,unknown,draft
pmi-en-0018,Das Kollektive Arbeitsrecht In der Post-Merger-Integration,Anna Jung,en,2011,Unknown,,Securities & Investment Banking,PMI,practice,post merger integration,unknown,draft
pmi-en-0019,Organisatorische Gestaltung in der Post Merger Integration,Sven Hackmann,en,2011,Unknown,,Securities & Investment Banking,PMI,practice,post merger integration,unknown,draft
pmi-en-0020,Post Merger Integration - Die Kunst einen gemeinsamen Nenner zu finden,Jens Schmidt,en,2011,Unknown,,Securities & Investment Banking,PMI,practice,post merger integration,unknown,draft
pmi-en-0021,Post Merger Integration Management,Stefan Sabrautzki,en,2010,Unknown,,Securities & Investment Banking,PMI,practice,post merger integration,unknown,draft
pmi-en-0022,Guidelines for process safety acquisition evaluation and post merger integration,American Institute of Chemical Engineers. Center for Chemical Process Safety,en,2010,Unknown,,Securities & Investment Banking,PMI,practice,post merger integration,unknown,draft
pmi-en-0023,Changes in European Corporate Law - an Opportunity for Successful Post Merger Integration?,Manuela Schweizer,en,2010,Unknown,,Securities & Investment Banking,PMI,practice,post merger integration,unknown,draft
pmi-en-0024,POST MERGER INTEGRATION ALS KRITISCHER ERFOLGSFAKTOR VON MERGERS AND ACQUISITIONS UNTER BESONDERER BERÜCKSICHTIGUNG DER BALANCED SCORECARD,Patrick Möws,en,2010,Unknown,,Securities & Investment Banking,PMI,practice,post merger integration,unknown,draft
pmi-en-0025,Post-merger intercultural communication in multinational companies,Christina Burek,en,2010,Unknown,,Securities & Investment Banking,PMI,practice,post merger integration,unknown,draft
pmi-ja-0001,闇と闇と光　THIS IS M&A ESSENTIAL,恵島良太郎,ja,2025,幻冬舎,,Securities & Investment Banking,PMI,practice,PMI 統合,unknown,draft
pmi-ja-0002,未来へ事業をつなぐ　中小M&Aガイド,事業承継支援コンサルティング研究会,ja,2025,ロギカ書房,,Securities & Investment Banking,PMI,practice,文化統合 M&A,unknown,draft
pmi-ja-0003,専門家のための 中小PMI実践ガイドブック,事業承継支援コンサルティング研究会,ja,2024,ロギカ書房,,Securities & Investment Banking,PMI,practice,PMI 統合,unknown,draft
pmi-ja-0004,M&A成長戦略,丹尾渉; 戦略総合研究所,ja,2024,ダイヤモンド社,,Securities & Investment Banking,PMI,practice,PMI 統合,unknown,draft
pmi-ja-0005,【事例研究】事業承継・M&A支援ガイドブック,岸田康雄,ja,2024,ロギカ書房,,Securities & Investment Banking,PMI,practice,組織統合 M&A,unknown,draft
pmi-ja-0006,人事部員の基礎知識,林浩二; 井上達夫; 國澤勇人,ja,2024,日本能率協会マネジメントセンター,,Securities & Investment Banking,PMI,practice,人事制度統合,unknown,draft
pmi-ja-0007,M&Aを成功に導く中小企業のPMI実践マニュアル,皿谷将,ja,2023,日本法令,4539729640,Securities & Investment Banking,PMI,practice,M&A PMI,unknown,draft
pmi-ja-0008,新釈　成功するM&Aの進め方,坪井孝太,ja,2022,ダイヤモンド社,,Securities & Investment Banking,PMI,practice,ポストマージャーインテグレーション,unknown,draft
pmi-ja-0009,Ｍ＆Ａ・組織再編の人事　トランスフォーメーションを達成するために,村中靖; 佐藤しおり,ja,2021,日経BP,,Securities & Investment Banking,PMI,practice,組織統合 M&A,unknown,draft
pmi-ja-0010,The Measurement of Post Deal Performance. An Empirical Analysis of European M&A Transactions,Tim Ulbricht,ja,2020,GRIN Verlag,9783346162731,Securities & Investment Banking,PMI,practice,M&A PMI,unknown,draft
pmi-ja-0011,Ｍ＆Ａと統合プロセス　人事労務ガイドブック,佐藤 広一,ja,2019,労働新聞社,9784897617770,Securities & Investment Banking,PMI,practice,PMI 統合,unknown,draft
pmi-ja-0012,日本型PMIの方法論,竹林 信幸,ja,2019,President Inc,,Securities & Investment Banking,PMI,practice,M&A PMI,unknown,draft
pmi-ja-0013,海外M&Aを成功に導くPMIの進め方,青嶋稔,ja,2019,Unknown,4502317713,Securities & Investment Banking,PMI,practice,M&A PMI,unknown,draft
pmi-ja-0014,クロスボーダーM&Aの組織・人事PMI,竹田年朗,ja,2019,Unknown,4502306215,Securities & Investment Banking,PMI,practice,M&A PMI,unknown,draft
pmi-ja-0015,トップコンサルタントが明かす　ポストM&A成功44の鉄則,田中大貴,ja,2018,日経BP,,Securities & Investment Banking,PMI,practice,PMI 統合,unknown,draft
pmi-ja-0016,Ｍ＆Ａシナジーを実現するＰＭＩ,要　慎吾; 中村　健太郎; 森田　純夫,ja,2016,東洋経済新報社,9784492533796,Securities & Investment Banking,PMI,practice,PMI 統合,unknown,draft
pmi-ja-0017,大前研一ビジネスジャーナル No.10（M&Aの成功条件／位置情報3.0時代のビジネスモデル）,,ja,2016,good.book,,Securities & Investment Banking,PMI,practice,ポストマージャーインテグレーション,unknown,draft
pmi-ja-0018,M&Aを成功に導くPMI,三宅卓,ja,2015,President Inc,,Securities & Investment Banking,PMI,practice,M&A 統合 実務,unknown,draft
pmi-ja-0019,企業買収後の統合プロセス,前田絵理; 菊池庸介,ja,2014,Unknown,4502079006,Securities & Investment Banking,PMI,practice,M&A PMI,unknown,draft
pmi-ja-0020,トップM&Aアドバイザーが初めて明かす中小企業M&A 34の真実,藤井一郎,ja,2013,東洋経済新報社,9784492533307,Securities & Investment Banking,PMI,practice,シナジー 創出,unknown,draft
def-en-0001,Overview of Takeover Defenses,Richard S. Ruback; Sloan School of Management,en,2022,Unknown,,Securities & Investment Banking,M&A Defense,practice,takeover defense,unknown,draft
def-en-0002,M&a Hostile Takeover Defense,Sameer Jain,en,2021,Unknown,,Securities & Investment Banking,M&A Defense,practice,hostile takeover defense,unknown,draft
def-en-0003,Daffodils and Poisonous Pills,Abby Reede,en,2020,Unknown,,Securities & Investment Banking,M&A Defense,practice,poison pill,unknown,draft
def-en-0004,Poison in the Pills,August Raine,en,2020,Unknown,,Securities & Investment Banking,M&A Defense,practice,poison pill,unknown,draft
def-en-0005,Poison Pills,Marcella Blok,en,2017,Unknown,,Securities & Investment Banking,M&A Defense,practice,poison pill,unknown,draft
def-en-0006,Poison Pill,Glenn Kaplan,en,2013,Unknown,,Securities & Investment Banking,M&A Defense,practice,poison pill,unknown,draft
def-en-0007,Poison Pill in Paradise,Stephen Gravett,en,2011,Unknown,,Securities & Investment Banking,M&A Defense,practice,poison pill,unknown,draft
def-en-0008,Takeover defense,Arthur Fleischer,en,2010,Unknown,,Securities & Investment Banking,M&A Defense,practice,takeover defense,unknown,draft
def-en-0009,"A ""poison pill?""",Brian Jay Rose,en,2008,Unknown,,Securities & Investment Banking,M&A Defense,practice,poison pill,unknown,draft
def-en-0010,Defense Strategies Against Hostile Takeovers,Jan Steinbächer,en,2007,Unknown,,Securities & Investment Banking,M&A Defense,practice,hostile takeover defense,unknown,draft
def-en-0011,Defence communication,,en,2007,Unknown,,Securities & Investment Banking,M&A Defense,practice,poison pill,unknown,draft
def-en-0012,Corporate Takeover Defenses 2004,,en,2006,Unknown,,Securities & Investment Banking,M&A Defense,practice,takeover defense,unknown,draft
def-en-0013,Poisoned Pills,Michael G Tolson,en,2006,Unknown,,Securities & Investment Banking,M&A Defense,practice,poison pill,unknown,draft
def-en-0014,The Poison Pill,Marciano Guerrero,en,2006,Unknown,,Securities & Investment Banking,M&A Defense,practice,poison pill,unknown,draft
